{
  "id": "lying",
  "title": "Unprecedented Lying & \"Alternative Facts",
  "slug": "lying",
  "description": "# Unprecedented Lying & \"Alternative Facts\"\n\nThe Washington Post documented **30,573 false or misleading claims** during Trump's first term alone—an average of **21 per day**. By his final year, Trump averaged **39 false claims per day** [Source: Washington Post Fact Checker Database, January 20, 2021]. Historian Douglas Brinkley: \"No president has ever been a 'serial liar' like Trump\" [Source: CNN interview, 2020]. The Post created a new category, the **\"Bottomless Pinocchio,\"** for falsehoods repeated 20+ times—Trump was the only politician to qualify, with 14 statements [Source: Washington Post, December 2018]. Steve Bannon described the strategy: **\"Flood the zone with shit\"** [Source: Michael Lewis interview, 2018]. CNN fact-checker Daniel Dale notes Trump \"manages to outlast most of the media's willingness to correct any particular falsehood\" through \"shameless perseverance\" [Source: CNN, 2020].\n\n## \"Alternative Facts\" - Inauguration Crowd Size (January 21, 2017)\n\nTrump's first official lie as president—and the birth of \"alternative facts\":\n\n- Trump claimed \"the largest audience to ever witness an inauguration, period, both in person and around the globe\"\n- Aerial photos from Reuters clearly showed Obama's 2009 crowd was approximately **3x larger**\n- Crowd expert estimate: Obama 2009 had **1.8 million**; Trump had **~200,000**\n- Metro ridership: **570,557** for Trump vs. **1.1 million** for Obama 2009\n- TV ratings: **30.6 million** for Trump vs. **38 million** for Obama 2009\n- Press Secretary Sean Spicer: \"This was the largest audience to ever witness an inauguration—period\"\n- **Kellyanne Conway** defending Spicer: **\"Sean Spicer gave alternative facts\"**\n- Chuck Todd: \"Alternative facts are not facts. They're falsehoods.\"\n- Also lied about weather: Claimed it \"never rained\" during his speech—video shows visible rain\n- Trump personally directed Spicer to make false claims (per Conway)\n\n## \"Sharpiegate\" - Hurricane Dorian Map (September 2019)\n\nTrump falsely claimed Alabama was in Hurricane Dorian's path, then doctored a government map to avoid admitting error:\n\n- **September 1, 2019:** Tweeted Alabama would \"most likely be hit (much) harder than anticipated\"\n- National Weather Service Birmingham immediately corrected: \"Alabama will NOT see any impacts from #Dorian. We repeat, no impacts\"\n- Instead of correcting, Trump displayed official NOAA map in Oval Office **altered with black Sharpie** extending hurricane path to Alabama\n- White House pressured federal weather experts behind the scenes to validate Trump's incorrect claim\n- Boston Globe: Demonstrated his \"authoritarian need to manipulate the truth\"\n- Dangerous: Could cause confusion about actual storm path, endanger lives\n- #Sharpiegate trended worldwide with satirical memes\n\n## Revolutionary War \"Airports\" (July 4, 2019)\n\nDuring July 4th \"Salute to America\" speech at Lincoln Memorial, claimed Continental Army \"took over the airports\" in the 1770s:\n\n- **\"Our Army manned the air, it rammed the ramparts, it took over the airports, it did everything it had to do\"**\n- Also confused Revolutionary War with War of 1812, referencing Fort McHenry (1814) in same passage\n- Wright Brothers' first flight: **1903**—over 125 years after Revolutionary War\n- First commercial airport: College Park, Maryland, **1909**\n- Trump blamed teleprompter malfunction: \"The teleprompter went out. It went kaput.\"\n- #RevolutionaryWarAirports trended worldwide\n\n## COVID-19 Disinformation (2020)\n\n- **February 2020:** \"It's going to disappear. One day—it's like a miracle—it will disappear\"\n- **April 23, 2020 press conference:** Suggested researching injection of disinfectant as COVID treatment\n    - Exact quote: \"And then I see the disinfectant, where it knocks it out in a minute, one minute. And is there a way we can do something like that by injection inside or almost a cleaning?\"\n    - Manufacturers including Lysol and Clorox issued emergency warnings not to ingest disinfectants\n    - Next day claimed he was \"being sarcastic\"—video clearly shows he was addressing medical experts seriously\n    - CNN: \"Trump lied Friday when he said he was being 'sarcastic'\"\n- Also suggested bringing UV light \"inside the body\"\n- Repeatedly promoted unproven hydroxychloroquine\n\n## Second Term Lies (2025)\n\nCNN fact-checked **100 false claims in Trump's first 100 days** of second term alone—and that was not comprehensive. Pattern continues unabated:\n\n- Falsely claimed bacon prices **\"quadrupled\"** under Biden (actual increase: ~19-21%)\n- Falsely claimed apple prices **\"doubled\"** under Biden (actual increase: ~7-8%)\n- Falsely claimed **\"grocery prices are down\"** (up 2.7% year-over-year per CPI)\n- Claimed he \"won youth by 36 points\"—Harris actually won voters ages 18-24, 25-29, and 30-39\n- Claimed drug prices would be cut **\"200%, 300%, 400%, 500%, 600%, 700%, 800%, 900%\"**—mathematically impossible (100% = free)\n- Falsely claimed \"Biden gave **$350 billion**\" to Ukraine (actual: ~$94-133 billion per IG and Kiel Institute)\n- Claimed to have \"ended eight wars\" and \"settled eight wars\"—significant exaggeration\n- Falsely claimed Washington DC has **\"no murders\"**—homicides continued throughout 2025\n- Falsely claimed Ukraine **\"started\"** the war that Russia invaded\n- Claimed Zelenskyy expressed **\"zero gratitude\"**—CNN compiled 78 examples of Zelenskyy thanking US\n- Falsely claimed his uncle taught Ted Kaczynski at MIT—Kaczynski attended Harvard and Michigan, never MIT; uncle died 1985, Kaczynski identified 1996\n- **Joint address to Congress (March 2025):** Fact-checkers identified 12+ separate lies\n- **UN speech (September 2025):** Spoke for 57 minutes (15-minute limit for all speakers), multiple false claims\n- **December 2025 posting spree:** 150+ Truth Social posts between 9pm-midnight including conspiracy theories\n- Shared Alex Jones conspiracy that Michelle Obama used Biden's autopen to sign pardons\n- White House website publishes **\"100 Days of Hoaxes\"** page attacking fact-checkers\n\n## Other Notable First-Term Lies\n\n- **Boy Scouts (2017):** Claimed \"head of the Boy Scouts\" called to say Trump's speech was \"the greatest speech that was ever made to them\"—Boy Scouts confirmed no such call was made\n- **Swedish ancestry:** For decades claimed grandfather came from Sweden—both of Fred Trump's parents were German; Fred lied due to anti-German sentiment\n- **Predicted 9/11:** Falsely claimed he predicted Osama bin Laden attack \"one year before\" in his 2000 book—bin Laden was already well-known when book published\n- **PolitiFact awarded Trump \"Lie of the Year\"** in 2015, 2017, and 2019",
  "summary": "The Washington Post documented 30,573 false or misleading claims during Trump's first term alone—an average of 21 per day. By his final year, Trump averaged 39 false claims per day . Historian Douglas Brinkley: \"No president has ever been a 'serial liar' like Trump\" . The Post created a new category, the \"Bottomless Pinocchio,\" for falsehoods repeated 20+ times—Trump was the only politician to ...",
  "date": "2019-09-01",
  "tags": {
    "timeline": [
      "campaign-2016",
      "first-term",
      "second-term"
    ],
    "type": [
      "political"
    ],
    "topic": [
      "racism",
      "foreign-policy",
      "covid"
    ],
    "severity": "disputed"
  },
  "keyPoints": [
    "Trump claimed \"the largest audience to ever witness an inauguration, period, both in person and around the globe\"",
    "Aerial photos from Reuters clearly showed Obama's 2009 crowd was approximately **3x larger**",
    "Crowd expert estimate: Obama 2009 had **1.8 million**; Trump had **~200,000**",
    "Metro ridership: **570,557** for Trump vs. **1.1 million** for Obama 2009",
    "TV ratings: **30.6 million** for Trump vs. **38 million** for Obama 2009",
    "Press Secretary Sean Spicer: \"This was the largest audience to ever witness an inauguration—period\"",
    "**Kellyanne Conway** defending Spicer: **\"Sean Spicer gave alternative facts\"**",
    "Chuck Todd: \"Alternative facts are not facts. They're falsehoods.\"",
    "Also lied about weather: Claimed it \"never rained\" during his speech—video shows visible rain",
    "Trump personally directed Spicer to make false claims (per Conway)",
    "**September 1, 2019:** Tweeted Alabama would \"most likely be hit (much) harder than anticipated\"",
    "National Weather Service Birmingham immediately corrected: \"Alabama will NOT see any impacts from #Dorian. We repeat, no impacts\"",
    "Instead of correcting, Trump displayed official NOAA map in Oval Office **altered with black Sharpie** extending hurricane path to Alabama",
    "White House pressured federal weather experts behind the scenes to validate Trump's incorrect claim",
    "Boston Globe: Demonstrated his \"authoritarian need to manipulate the truth\"",
    "Dangerous: Could cause confusion about actual storm path, endanger lives",
    "#Sharpiegate trended worldwide with satirical memes",
    "**\"Our Army manned the air, it rammed the ramparts, it took over the airports, it did everything it had to do\"**",
    "Also confused Revolutionary War with War of 1812, referencing Fort McHenry (1814) in same passage",
    "Wright Brothers' first flight: **1903**—over 125 years after Revolutionary War",
    "First commercial airport: College Park, Maryland, **1909**",
    "Trump blamed teleprompter malfunction: \"The teleprompter went out. It went kaput.\"",
    "#RevolutionaryWarAirports trended worldwide",
    "**February 2020:** \"It's going to disappear. One day—it's like a miracle—it will disappear\"",
    "**April 23, 2020 press conference:** Suggested researching injection of disinfectant as COVID treatment",
    "Also suggested bringing UV light \"inside the body\"",
    "Repeatedly promoted unproven hydroxychloroquine",
    "Falsely claimed bacon prices **\"quadrupled\"** under Biden (actual increase: ~19-21%)",
    "Falsely claimed apple prices **\"doubled\"** under Biden (actual increase: ~7-8%)",
    "Falsely claimed **\"grocery prices are down\"** (up 2.7% year-over-year per CPI)",
    "Claimed he \"won youth by 36 points\"—Harris actually won voters ages 18-24, 25-29, and 30-39",
    "Claimed drug prices would be cut **\"200%, 300%, 400%, 500%, 600%, 700%, 800%, 900%\"**—mathematically impossible (100% = free)",
    "Falsely claimed \"Biden gave **$350 billion**\" to Ukraine (actual: ~$94-133 billion per IG and Kiel Institute)",
    "Claimed to have \"ended eight wars\" and \"settled eight wars\"—significant exaggeration",
    "Falsely claimed Washington DC has **\"no murders\"**—homicides continued throughout 2025",
    "Falsely claimed Ukraine **\"started\"** the war that Russia invaded",
    "Claimed Zelenskyy expressed **\"zero gratitude\"**—CNN compiled 78 examples of Zelenskyy thanking US",
    "Falsely claimed his uncle taught Ted Kaczynski at MIT—Kaczynski attended Harvard and Michigan, never MIT; uncle died 1985, Kaczynski identified 1996",
    "**Joint address to Congress (March 2025):** Fact-checkers identified 12+ separate lies",
    "**UN speech (September 2025):** Spoke for 57 minutes (15-minute limit for all speakers), multiple false claims",
    "**December 2025 posting spree:** 150+ Truth Social posts between 9pm-midnight including conspiracy theories",
    "Shared Alex Jones conspiracy that Michelle Obama used Biden's autopen to sign pardons",
    "White House website publishes **\"100 Days of Hoaxes\"** page attacking fact-checkers",
    "**Boy Scouts (2017):** Claimed \"head of the Boy Scouts\" called to say Trump's speech was \"the greatest speech that was ever made to them\"—Boy Scouts confirmed no such call was made",
    "**Swedish ancestry:** For decades claimed grandfather came from Sweden—both of Fred Trump's parents were German; Fred lied due to anti-German sentiment",
    "**Predicted 9/11:** Falsely claimed he predicted Osama bin Laden attack \"one year before\" in his 2000 book—bin Laden was already well-known when book published",
    "**PolitiFact awarded Trump \"Lie of the Year\"** in 2015, 2017, and 2019"
  ],
  "sources": [
    {
      "text": "Washington Post Fact Checker Database, January 20, 2021",
      "type": "news"
    },
    {
      "text": "CNN interview, 2020",
      "type": "news"
    },
    {
      "text": "Washington Post, December 2018",
      "type": "news"
    },
    {
      "text": "Michael Lewis interview, 2018",
      "type": "news"
    },
    {
      "text": "CNN, 2020",
      "type": "news"
    }
  ],
  "metadata": {
    "featured": false,
    "priority": 5,
    "lastUpdated": "2026-01-20T21:00:29.835Z",
    "status": "active"
  }
}